{
  "schema": "pr4109/r00-frozen-inputs/v1",
  "version": 1,
  "captured_at_utc": "2026-08-27T15:44:22Z",
  "repository": "threshold-network/keep-core",
  "pull_request": 4109,
  "baseline_source_commit": "1bc7edf9965cac43de3bd18060e07ba678670073",
  "baseline_parent_commit": "d2a95eed0b259805aa710e4184377180ade368bc",
  "evaluated_candidate_commit": "d7bf8c0753f3aac574f8d20d93c75268f350b389",
  "evaluated_candidate_base": "a7ac8989b662d51d8a94fa28f1ac226058d5d6cc",
  "inputs": [
    {
      "name": "independently_tested_r1",
      "repository": "threshold-network/keep-core",
      "identity": "2228ba0860455dc36672459565741b0a74697b13",
      "version": null,
      "checksum": null,
      "verification": "local_git_object",
      "purpose": "Historical R1 control; an ancestor of the baseline, not the baseline itself."
    },
    {
      "name": "prior_keep_core",
      "repository": "threshold-network/keep-core",
      "identity": "66b187efdbe1cd567950de0efe9728de95886b13",
      "version": "v2.5.2",
      "checksum": null,
      "verification": "local_git_object_and_tag",
      "purpose": "PRIOR source for dependency, storage, and behavior comparison."
    },
    {
      "name": "candidate_tss_lib",
      "repository": "threshold-network/tss-lib",
      "identity": "d847ce0030193ccf5dbec0097571dcce5a2a5cf6",
      "version": "v0.0.0-20260729021955-d847ce003019",
      "checksum": "h1:EmD85fdfi20RKON39+Hho5zmB57gHj7EWd7pTYwsqRY=",
      "verification": "go_mod_go_sum_and_upstream_commit",
      "purpose": "Exact TSS fork consumed by the evaluated candidate."
    },
    {
      "name": "prior_tss_lib",
      "repository": "threshold-network/tss-lib",
      "identity": "2e712689cfbeefede15f95a0ec7112227d86f702",
      "version": "v0.0.0-20230901144531-2e712689cfbe",
      "checksum": "h1:dOKhoYxZjXwFIyGnxgU+Sa1obZPMHRhu6e44oOLkzU4=",
      "verification": "prior_keep_core_go_mod_go_sum_and_upstream_commit",
      "purpose": "Historical TSS implementation consumed by PRIOR and required by cross-version transcript controls."
    },
    {
      "name": "candidate_keep_common",
      "repository": "threshold-network/keep-common",
      "identity": "v1.7.1-tlabs.1",
      "version": "v1.7.1-tlabs.1",
      "checksum": "h1:GcaQUb/5TOdc1Vhs4ZsbLM5a1C0CXx7Nmqv4npNKTag=",
      "verification": "go_mod_go_sum",
      "purpose": "Exact chain-counter and subscription dependency consumed by the candidate."
    },
    {
      "name": "tbtc_v2_lifecycle_reference",
      "repository": "threshold-network/tbtc-v2",
      "identity": "280da5c4ca6aa066f0ea7291076e4c70085723a9",
      "version": null,
      "checksum": null,
      "verification": "upstream_commit",
      "purpose": "Bridge, Bank, and SPV lifecycle reference named by the frozen R00 scope."
    },
    {
      "name": "external_do_harness_reference",
      "repository": "tlabs-xyz/pr4109-do-infra",
      "identity": "7cbecdde357af30eecb25cfba767851da9ce3dd4",
      "version": null,
      "checksum": null,
      "verification": "unverified_external_scope_reference",
      "purpose": "External P08/B08F/P15/P16B harness identity copied from the frozen scope; its private repository is not accessible to keep-core CI and no execution evidence is claimed here."
    }
  ]
}
